{
  "version": "1.4.10",
  "windows_label": "2019",
  "binary_sha256": "edf9a428a18bd8beb1bb262d2a5d126ae11843b1874c54c033b29e243fb2a833",
  "review_status": "approved (verified: no leak-terms match; DES key scrubbed via context-aware rule; binary sha256 preserved for reproducibility)",
  "verbs": [
    {
      "verb": "scan",
      "status": "fail (rc=1)",
      "elapsed_s": 0,
      "receipt_lines": 13
    },
    {
      "verb": "enum_samr",
      "status": "fail (rc=1)",
      "elapsed_s": 0,
      "receipt_lines": 6
    },
    {
      "verb": "enum_lsa",
      "status": "fail (rc=2)",
      "elapsed_s": 0,
      "receipt_lines": 6
    },
    {
      "verb": "enum_krb_users",
      "status": "pass",
      "elapsed_s": 0,
      "receipt_lines": 5
    },
    {
      "verb": "enum_posture",
      "status": "fail (rc=1)",
      "elapsed_s": 0,
      "receipt_lines": 6
    },
    {
      "verb": "enum_adcs",
      "status": "fail (rc=1)",
      "elapsed_s": 0,
      "receipt_lines": 6
    },
    {
      "verb": "attack_roast",
      "status": "fail (rc=1)",
      "elapsed_s": 0,
      "receipt_lines": 6
    },
    {
      "verb": "attack_dcsync_krbtgt",
      "status": "pass",
      "elapsed_s": 0,
      "receipt_lines": 5
    },
    {
      "verb": "attack_secretsdump",
      "status": "pass",
      "elapsed_s": 0,
      "receipt_lines": 5
    },
    {
      "verb": "attack_zerologon",
      "status": "fail (rc=2)",
      "elapsed_s": 0,
      "receipt_lines": 6
    }
  ]
}